{
  "version": "2.16.0",
  "conclusions": {
    "Conforme": {
      "severity": "Conforme",
      "priority": 3,
      "description": "Serviço aprovado e correto."
    },
    "Não Conforme": {
      "severity": "Não Conforme",
      "priority": 2,
      "description": "Serviço aprovado, mas corrigido pelo setor de análise ou com problema que deve ser pontuado sem justificar reprovação."
    },
    "Reprovado": {
      "severity": "Reprovado",
      "priority": 1,
      "description": "Serviço sem execução válida, em local incorreto, sem evidência suficiente ou com falha grave que impeça aprovação."
    }
  },
  "services": [
    {
      "id": "reparo-cavalete",
      "name": "Reparo de Cavalete de Água",
      "category": "Distribuição de Água",
      "summary": "Regras de validação utilizadas pelo setor de análise para o serviço Reparo de Cavalete.",
      "insights": [
        "A foto depois da execução é crítica: se faltar, o resultado é Reprovado.",
        "Falta da foto antes ou durante resulta em Não Conforme.",
        "Falta de duas ou mais etapas resulta em Reprovado.",
        "Foto do chassi sem número de hidrômetro visível resulta em Não Conforme.",
        "Ausência de evidência da troca do lacre resulta em Não Conforme.",
        "Serviço em local incorreto ou sem necessidade resulta em Reprovado.",
        "Fachada ampla, chassi, ponto do vazamento, execução e finalização compõem o padrão fotográfico.",
        "Troca exclusiva do registro exige o serviço Substituição de Registro de Cavalete (122003).",
        "Intervenção no ramal ou na rede exige troca do tipo de serviço e registro de Não Conformidade.",
        "Troca de hidrômetro quebrado ou avariado deve ser encaminhada ao setor Comercial mediante Vistoria de Irregularidade."
      ],
      "suggestedQuestions": [
        "Sem foto depois da execução, qual a decisão?",
        "Faltou a foto antes e também a foto do chassi, qual a conclusão?",
        "Faltou apenas a foto durante a execução, como classificar?",
        "Faltaram as fotos antes e durante, qual o resultado?",
        "Se faltar a foto do chassi e a foto final, qual regra prevalece?",
        "Quando devo trocar o serviço para Substituição de Registro de Cavalete?",
        "Quem deve trocar um hidrômetro quebrado?",
        "Quais fotos são obrigatórias no reparo de cavalete?"
      ],
      "analysisStatus": "active",
      "parameterization": {
        "serviceExchange": [
          "desobstrucao-ramal-agua",
          "reparo-ramal-agua-asfalto",
          "reparo-ramal-agua-bloco-paralelo",
          "reparo-ramal-agua-calcada",
          "reparo-ramal-agua-terra",
          "reparo-ramal-agua-causado-por-terceiros",
          "reparo-rede-agua-asfalto",
          "reparo-furto-vandalismo",
          "substituicao-ramal-agua",
          "substituicao-registro-cavalete"
        ],
        "executedAdditional": [
          "desobstrucao-ramal-agua",
          "reaterro-valas-asfalto",
          "reaterro-valas-calcada",
          "reaterro-valas-terra",
          "repavimentacao-asfalto-ate-1m2",
          "repavimentacao-calcada",
          "repavimentacao-ceramica",
          "repavimentacao-concreto",
          "repavimentacao-muro-alvenaria"
        ],
        "subsequentAdditional": [
          "escavacao-retirada-material",
          "padronizacao-cavalete-agua",
          "reaterro-valas-asfalto",
          "reaterro-valas-calcada",
          "reaterro-valas-terra",
          "reparo-ramal-agua-calcada",
          "repavimentacao-asfalto-acima-1m2",
          "repavimentacao-asfalto-ate-1m2",
          "repavimentacao-bloco-paralelo",
          "repavimentacao-calcada",
          "repavimentacao-ceramica",
          "repavimentacao-concreto",
          "repavimentacao-muro-alvenaria",
          "retirada-entulho",
          "vistoria-irregularidade",
          "vistoria-irregularidade-furto-agua"
        ]
      }
    },
    {
      "id": "desobstrucao-ramal-agua",
      "name": "Desobstrução de Ramal de Água",
      "category": "Parametrização Operacional",
      "summary": "Serviço disponível no sistema como serviço original ou parametrizado por outro serviço.",
      "insights": ["Regras de análise e parametrização própria ainda não foram fornecidas."],
      "analysisStatus": "rules_pending"
    },
    {
      "id": "reparo-ramal-agua-asfalto",
      "name": "Reparo de Ramal de Água - Asfalto",
      "category": "Parametrização Operacional",
      "summary": "Reparo executado no ramal de água quando a intervenção ocorre em pavimento asfáltico.",
      "insights": [
        "As fotos devem identificar o local, a situação encontrada, o reparo executado e a finalização.",
        "A intervenção no ramal precisa estar visível; mencionar somente o cavalete não comprova o reparo do ramal.",
        "Não é obrigatória foto do chassi ou do hidrômetro neste serviço.",
        "A abertura do asfalto normalmente exige reaterro e repavimentação coerentes com o que foi executado ou ficou pendente."
      ],
      "suggestedQuestions": ["Quais fotos comprovam o reparo do ramal?","O que deve aparecer na foto da finalização?"],
      "analysisStatus": "active"
    },
    {
      "id": "reparo-ramal-agua-bloco-paralelo",
      "name": "Reparo de Ramal de Água - Bloco/Paralelo",
      "category": "Parametrização Operacional",
      "summary": "Reparo executado no ramal de água em calçada ou rua com revestimento em blocos.",
      "insights": [
        "Abrange bloco, paralelepípedo, pedra portuguesa, miracema e piso intertravado.",
        "As fotos devem identificar o local, a situação encontrada, o reparo executado e a finalização.",
        "Não é obrigatória foto do chassi ou do hidrômetro neste serviço.",
        "A abertura do piso normalmente exige reaterro e recomposição do revestimento correspondente."
      ],
      "analysisStatus": "active",
      "catalogNameStatus": "needs_confirmation",
      "sourceLabel": "REPARO DE RAMAL DE ÁGUA - BLOCO/PAR..."
    },
    {
      "id": "reparo-ramal-agua-calcada",
      "name": "Reparo de Ramal de Água - Calçada",
      "category": "Parametrização Operacional",
      "summary": "Reparo executado no ramal de água em passeio ou calçada com revestimento de concreto.",
      "insights": [
        "As fotos devem identificar o local, a situação encontrada, o reparo executado e a finalização.",
        "Quando a intervenção necessária não for executada na visita, este serviço pode ser indicado como adicional posterior.",
        "Não é obrigatória foto do chassi ou do hidrômetro neste serviço.",
        "A abertura da calçada normalmente exige reaterro e repavimentação coerentes com o que foi executado ou ficou pendente."
      ],
      "analysisStatus": "active"
    },
    {
      "id": "reparo-ramal-agua-terra",
      "name": "Reparo de Ramal de Água - Terra",
      "category": "Parametrização Operacional",
      "summary": "Reparo executado no ramal de água quando a intervenção ocorre em solo de terra.",
      "insights": [
        "As fotos devem identificar o local, a situação encontrada, o reparo executado e a finalização.",
        "A intervenção no ramal precisa estar visível.",
        "Não é obrigatória foto do chassi ou do hidrômetro neste serviço.",
        "O solo deve ser reaterrado e finalizado, mas Ramal Terra não exige repavimentação apenas por ser um reparo de ramal."
      ],
      "analysisStatus": "active"
    },
    {
      "id": "reparo-ramal-agua-causado-por-terceiros",
      "name": "Reparo de Ramal de Água Causado por Terceiros",
      "category": "Parametrização Operacional",
      "summary": "Reparo executado no ramal de água quando o dano foi causado por terceiros.",
      "insights": [
        "O final do nome ainda precisa ser confirmado em uma captura sem corte.",
        "O padrão técnico geral de reparo de ramal exige identificação do local, situação encontrada, reparo e finalização.",
        "Não é obrigatória foto do chassi ou do hidrômetro; reaterro e repavimentação dependem do revestimento mostrado na intervenção."
      ],
      "analysisStatus": "active",
      "catalogNameStatus": "needs_confirmation",
      "sourceLabel": "REPARO DE RAMAL DE ÁGUA CAUSADO PO..."
    },
    {
      "id": "reparo-rede-agua-asfalto",
      "name": "Reparo de Rede de Água - Asfalto",
      "category": "Parametrização Operacional",
      "summary": "Reparo de rede de água em área com pavimento asfáltico.",
      "insights": [
        "As fotos devem identificar local, defeito, método executado, medições e finalização.",
        "As etapas antes, durante e depois seguem o padrão geral do Reparo de Ramal, sem exigir chassi ou hidrômetro.",
        "A metragem informada no formulário deve estar comprovada nas evidências; sem comprovação, o campo deve ser zerado e pontuado como Não Conforme.",
        "Intervenções com seis metros ou mais exigem conferência do enquadramento como substituição de rede."
      ],
      "suggestedQuestions": ["Quais fotos comprovam o reparo de rede?","O que fazer com metragem não comprovada?"],
      "analysisStatus": "active"
    },
    {
      "id": "reparo-furto-vandalismo",
      "name": "Reparo por Furto/Vandalismo",
      "category": "Parametrização Operacional",
      "summary": "Serviço disponível no sistema como serviço original ou troca de serviço.",
      "insights": ["Regras de análise e parametrização própria ainda não foram fornecidas."],
      "analysisStatus": "rules_pending"
    },
    {
      "id": "substituicao-ramal-agua",
      "name": "Substituição de Ramal de Água",
      "category": "Parametrização Operacional",
      "summary": "Serviço disponível no sistema como serviço original ou troca de serviço.",
      "insights": ["Regras de análise e parametrização própria ainda não foram fornecidas."],
      "analysisStatus": "rules_pending"
    },
    {
      "id": "substituicao-registro-cavalete",
      "name": "Substituição de Registro de Cavalete",